{
  "run_id": "SIW-REFINE-20261010-001",
  "timestamp": "2026-10-10T07:50:00Z",
  "task_digest": "1b44a4014881e477adbfdd00267912d881f1eb15c29d324fa098af65f183725d",
  "status": "NOT-YET-VERIFIED",
  "depth_reached": 1,
  "iterations_used": 1,
  "steps_used": 8,
  "halt_reason": "Stopped after one bounded refinement cycle; independent validation is required before merge or promotion.",
  "evidence_digests": [
    "55398ea2cdebb9f38adb469df2c68ee9179a3f6ec860d05b95fb6274015919b0"
  ],
  "provenance": {
    "agent_id": "chatgpt-siw-activation-agent",
    "capability_ids": [
      "siw-validation",
      "siw-evidence",
      "siw-provenance",
      "siw-run-record"
    ],
    "parent_run_id": "SIW-ACT-20261010-001",
    "git_commit": "3a64fde19c40a8ad7b201ccd044d56ea53cce5f1"
  },
  "unresolved_questions": [
    "Independent review of this refinement has not occurred.",
    "Static checks do not prove runtime correctness or real-world efficacy.",
    "No CI workflow was executed through the available GitHub connector.",
    "Recognition remains continuous and unresolved."
  ],
  "notes": "One refinement cycle completed on a dedicated branch. Static assertions passed and the skill's repository-defined token estimate is 456 (<500). No merge or promotion."
}
