{
  "run_id": "SIW-REFINE-20261010-002",
  "timestamp": "2026-10-10T07:52:06Z",
  "task_digest": "f60f89d940b3ddcdb3965e8f39c6913bbdc5c0b63699c9d7dcfbf91b0688f165",
  "status": "NOT-YET-VERIFIED",
  "depth_reached": 1,
  "iterations_used": 1,
  "steps_used": 8,
  "halt_reason": "Bounded cycle complete; stop before merge or promotion pending independent review and runtime-architecture decision.",
  "evidence_digests": [
    "6785cac38bd0e7219ebbbbb982cfcf2058abae7d9bb1cb746cdc52da168daafa"
  ],
  "provenance": {
    "agent_id": "chatgpt-siw-activation-agent",
    "capability_ids": [
      "siw-signal",
      "siw-validation",
      "siw-evidence",
      "siw-provenance",
      "siw-run-record",
      "siw-refine"
    ],
    "parent_run_id": "SIW-ACT-20261010-001",
    "git_commit": "9e0a187d3ba8df109591a9854e057f55d497cd3d"
  },
  "unresolved_questions": [
    "Independent review of the integrity validator, tests, and workflow has not occurred.",
    "The Python scaffold in the uploaded archive is not integrated into the current repository; decide whether and how to integrate its runtime.",
    "The archived Windows bundle validator's agent-path mismatch remains unresolved because that validator is outside the current repository.",
    "Recognition remains continuous and unresolved.",
    "Passing repository-integrity checks does not establish reasoning quality or real-world efficacy."
  ],
  "notes": "CI workflow Marketplace integrity run 38035895772 completed successfully on PR merge commit cfc0fecb114647c4c174dbfa1b19ae06c60a37cd: 5 unit tests passed and repository marketplace validation passed. Evidence digest is SHA-256 of canonical JSON for the corresponding 01-evidence.json payload."
}
