{
  "run_id": "SIW-AUTO-BUILD-20261010-001",
  "timestamp": "2026-10-10T08:04:43Z",
  "task_digest": "cd3824062cfa825cd7aeb091108577cfbdf072a7b05cf349fdc3de8db704d292",
  "status": "NOT-YET-VERIFIED",
  "depth_reached": 1,
  "iterations_used": 1,
  "steps_used": 20,
  "halt_reason": "Bounded implementation and CI cycle complete; hold before promotion for independent review and explicit user command.",
  "evidence_digests": [
    "fd1d4924c990c6dd0eb477a08af2c67ba48feed259e6f97ea9581b74053ba635"
  ],
  "provenance": {
    "agent_id": "chatgpt-siw-activation-agent",
    "capability_ids": [
      "siw-autonomous-build",
      "siw-validation",
      "siw-evidence",
      "siw-provenance",
      "siw-run-record"
    ],
    "parent_run_id": "SIW-REFINE-20261010-002",
    "git_commit": "0f3f7bb08c59792edb61d23085e3958c44efbbbc"
  },
  "unresolved_questions": [
    "Independent review of the runtime, promotion gate, and CI workflow has not occurred.",
    "The runtime currently evaluates cycle/promotion gates and loads the catalog; it does not directly execute arbitrary skills or Git operations itself.",
    "Recognition remains continuous and unresolved.",
    "Passing software checks does not establish real-world reasoning efficacy."
  ],
  "notes": "Updated after CapCut intent integration and public documentation maintenance. GitHub Actions run 38036631098 passed on tested head 0f3f7bb08c59792edb61d23085e3958c44efbbbc: 21 tests passed, marketplace integrity passed, and public documentation integrity passed. Evidence digest is SHA-256 of canonical JSON (sorted keys, compact separators) for the associated 01-evidence.json payload."
}
